{
  "$schema": "http://json-schema.org/draft-07/schema#",
  "$id": "https://praxis.dev/schemas/conversation.json",
  "title": "Conversation",
  "description": "Schema for a conversation in the praxis-conversations ingestion subsystem",
  "type": "object",
  "required": ["id", "timestamp", "turns", "metadata"],
  "properties": {
    "id": {
      "type": "string",
      "description": "Unique identifier for the conversation"
    },
    "timestamp": {
      "type": "string",
      "format": "date-time",
      "description": "ISO 8601 timestamp of conversation start"
    },
    "turns": {
      "type": "array",
      "description": "Array of conversation turns",
      "items": {
        "type": "object",
        "required": ["role", "content", "timestamp"],
        "properties": {
          "role": {
            "type": "string",
            "enum": ["user", "assistant", "system"],
            "description": "Role of the speaker"
          },
          "content": {
            "type": "string",
            "description": "Content of the turn"
          },
          "timestamp": {
            "type": "string",
            "format": "date-time",
            "description": "ISO 8601 timestamp of the turn"
          },
          "metadata": {
            "type": "object",
            "description": "Optional metadata for the turn"
          }
        }
      }
    },
    "metadata": {
      "type": "object",
      "description": "Conversation metadata",
      "properties": {
        "source": {
          "type": "string",
          "description": "Source of the conversation (e.g., 'github-copilot', 'cli', 'web')"
        },
        "userId": {
          "type": "string",
          "description": "User identifier (may be redacted)"
        },
        "sessionId": {
          "type": "string",
          "description": "Session identifier"
        },
        "tags": {
          "type": "array",
          "items": { "type": "string" },
          "description": "Tags for categorization"
        }
      }
    },
    "redacted": {
      "type": "boolean",
      "description": "Whether PII has been redacted",
      "default": false
    },
    "normalized": {
      "type": "boolean",
      "description": "Whether the conversation has been normalized",
      "default": false
    },
    "classified": {
      "type": "boolean",
      "description": "Whether the conversation has been classified",
      "default": false
    },
    "classification": {
      "type": "object",
      "description": "Classification results",
      "properties": {
        "category": {
          "type": "string",
          "description": "Primary category (e.g., 'feature-request', 'bug-report', 'question')"
        },
        "confidence": {
          "type": "number",
          "minimum": 0,
          "maximum": 1,
          "description": "Confidence score for classification"
        },
        "tags": {
          "type": "array",
          "items": { "type": "string" },
          "description": "Additional classification tags"
        }
      }
    }
  }
}
